url,title,summary,date
https://www.yna.co.kr/view/AKR20250610062800371,"베트남 결혼이주여성 부모, 내주 한국 찾아 딸·손주 만난다","17∼27일 '다문화가족 친정부모 초청 사업' 20명 참가 (서울=연합뉴스) 성도현 기자 = 한국인 남성과 결혼해 국내에 정착한 베트남 결혼이주여성의 친정 부모들이 딸과 손주를 만나기 위해 한국을 찾는다. 베트남 하노이 한-베트남가족협회는 오는 17∼27일 충청북도에 거주하는 베트남 결혼이주여성 10가정의 부모 20명이 '다문화가족 친정부모 초청 사업'으로 방한한다고 10일 밝혔다. 이 사업은 하노이한인회와 바르게살기운동 충청북도협의회가 공동 주관한다. 베트남 하노이 및 호찌민에 거주하는 친정 부모들은 17일 밤에 출국해 18일 오전 인천국제공항을 통해 입국한다. 이후 과거 대통령 전용 별장으로 사용됐던 청남대를 돌아본 뒤 김영환 충북도지사 초청 만찬에 참석한다. 이들은 19일부터 딸이 사는 가정을 방문해 사위 및 손자·손녀와 함께 지낸 뒤 27일 출국한다. 이 사업은 다문화가족 친정 부모와의 만남을 통해 한국과 베트남 간 우호를 증진하고 다문화가족의 한국 생활에 대한 자긍심을 고취하기 위해 2008년부터 매년 진행됐다. 16회인 올해가 사업 마지막 해로, 그간 400여명의 친정 부모가 방한해 딸이 사는 모습을 살폈다. 하노이한인회는 내년부터는 후속 사업으로 베트남 결혼이주여성들이 자녀와 함께 모국을 찾아 역사와 문화, 언어 등을 배우게 하는 '엄마나라 알기 문화체험'을 본격적으로 시작한다. 지난해 8월에는 바르게살기운동 제천시협의회와 함께 충북 제천시에 거주하는 한-베트남 다문화 8가정을 초청해 '엄마나라 알기 문화체험' 시범 사업을 진행했다. 주최 측은 다문화 2세 자녀 교육이 필요한 시점이 됐다고 보고 문화특강, 주베트남 한국대사관 방문, 하이퐁시 LG전자 견학, 친정집 방문 등의 세부 프로그램을 기획한 바 있다. 한국인과 베트남인이 결혼해 베트남에서 가정을 꾸린 사람들이 만든 단체인 한베가족협회는 2008년 '행복한 한베 가정을 만들겠다'는 취지에 따라 설립됐다.",2025-06-10
https://www.yna.co.kr/view/AKR20250610062800371,"베트남 결혼이주여성 부모, 내주 한국 찾아 딸·손주 만난다","17∼27일 '다문화가족 친정부모 초청 사업' 20명 참가 (서울=연합뉴스) 성도현 기자 = 한국인 남성과 결혼해 국내에 정착한 베트남 결혼이주여성의 친정 부모들이 딸과 손주를 만나기 위해 한국을 찾는다. 베트남 하노이 한-베트남가족협회는 오는 17∼27일 충청북도에 거주하는 베트남 결혼이주여성 10가정의 부모 20명이 '다문화가족 친정부모 초청 사업'으로 방한한다고 10일 밝혔다. 이 사업은 하노이한인회와 바르게살기운동 충청북도협의회가 공동 주관한다. 베트남 하노이 및 호찌민에 거주하는 친정 부모들은 17일 밤에 출국해 18일 오전 인천국제공항을 통해 입국한다. 이후 과거 대통령 전용 별장으로 사용됐던 청남대를 돌아본 뒤 김영환 충북도지사 초청 만찬에 참석한다. 이들은 19일부터 딸이 사는 가정을 방문해 사위 및 손자·손녀와 함께 지낸 뒤 27일 출국한다. 이 사업은 다문화가족 친정 부모와의 만남을 통해 한국과 베트남 간 우호를 증진하고 다문화가족의 한국 생활에 대한 자긍심을 고취하기 위해 2008년부터 매년 진행됐다. 16회인 올해가 사업 마지막 해로, 그간 400여명의 친정 부모가 방한해 딸이 사는 모습을 살폈다. 하노이한인회는 내년부터는 후속 사업으로 베트남 결혼이주여성들이 자녀와 함께 모국을 찾아 역사와 문화, 언어 등을 배우게 하는 '엄마나라 알기 문화체험'을 본격적으로 시작한다. 지난해 8월에는 바르게살기운동 제천시협의회와 함께 충북 제천시에 거주하는 한-베트남 다문화 8가정을 초청해 '엄마나라 알기 문화체험' 시범 사업을 진행했다. 주최 측은 다문화 2세 자녀 교육이 필요한 시점이 됐다고 보고 문화특강, 주베트남 한국대사관 방문, 하이퐁시 LG전자 견학, 친정집 방문 등의 세부 프로그램을 기획한 바 있다. 한국인과 베트남인이 결혼해 베트남에서 가정을 꾸린 사람들이 만든 단체인 한베가족협회는 2008년 '행복한 한베 가정을 만들겠다'는 취지에 따라 설립됐다.",2025-06-10
https://www.yna.co.kr/view/AKR20250610064800009,"中, 청년주택 확대·취준생 사회보험 보조금 등 민생대책 발표","최저임금 기준 인상·차상위 계층 파악 등으로 ""기초생활 확실히 보장"" (서울=연합뉴스) 권수현 기자 = 중국 정부가 청년주택 공급 확대, 취준생을 위한 사회보험 보조금 지급 등 민생 지원 대책을 공개했다. 10일 관영 신화통신과 차이롄서 등 중국 매체들에 따르면 중국공산당 중앙판공청과 국무원 판공청은 전날 이러한 내용을 담은 '민생 보장 및 개선을 진일보해 대중의 긴급하고 걱정스러운 문제를 해결하는 데 대한 의견'(2025년 3월2일 제정, 이하 의견)을 발표했다. 의견은 ""민생건설을 더 공정하고 균형있게, 보편적이고 접근 가능하게 추진하겠다""며 사회 보장 공평성 강화, 기본 공공서비스 균형 향상, 기초 민생 서비스 보편성 확대, 다양한 사회적 서비스 접근성 향상 등과 관련해 총 10개 항목의 추진 과제를 제시했다. 이 가운데 청년층 지원과 관련해서는 ""조건에 부합하는 대학 졸업생과 취업에 어려움을 겪는 사람들에게 사회보험 보조금을 지급하겠다""고 밝혔다. 의견은 또 ""보장성 주택(저소득층을 위해 저렴하게 공급하는 주택) 가운데 직장과 주거의 균형을 고려한 기숙사형과 소형 청년아파트 공급을 확대하도록 유도하고 지원""하는 등 청년들의 학업, 결혼 및 출산, 사회진출 등 과정에서 더 많은 지원을 제공하도록 청년발전 촉진 정책을 완비하겠다고 강조했다. 아울러 각 지역의 보장성 주택 공급을 확대하고 플랫폼노동 등 유연고용 형태로 취업한 사람의 주택공적금(주택 매입을 위해 기업과 노동자가 공동 부담하는 장기 적금) 가입을 추진하기로 했다. 차이롄서는 청년 주택 확대 방침과 관련해 전문가를 인용 ""청년층의 가장 큰 민생문제가 저렴한 주택 공급임을 보여준다""고 해석했다. 의견은 저소득층 지원책으로는 최저임금 기준 조정을 위한 메커니즘을 완비해 최저임금 기준을 합리적으로 인상하겠다고 말했다. 또 저소득층 인정 방법과 저소득 가정 경제상황 확인 방법을 마련해 최저생활보장 대상의 경계에 있는",2025-06-10
https://www.yna.co.kr/view/AKR20250610060200062,"강원도, 여름철 해양 비브리오균 감염 예방 앞장…감시 강화","심한 경우 패혈증 진행…각별한 주의 당부 (강릉=연합뉴스) 류호준 기자 = 강원특별자치도 보건환경연구원은 여름철 해양 비브리오균 감염 예방을 위해 감시 체계를 강화한다고 10일 밝혔다. 연구원은 동해안 해양환경 내 비브리오균 분포 조사를 연중 상시 모니터링 중으로, 여름철 해수 온도 상승과 물놀이 인구 증가 시기인 4∼9월 감시를 2배로 강화한다. 조사지역은 동해안 6개 시군(강릉, 동해, 속초, 삼척, 고성, 양양) 이다. 시군별로 해수 2개 지점(외항·내항)과 기수 1개 지점 등 총 18개 지점에서 시료를 채취해 병원성 비브리오균을 분석한다. 연구원에 따르면 최근 3년간 비브리오균 검출 시기는 2022년 7∼9월, 2023년 8∼12월, 2024년 6∼12월로 매년 검출 기간이 점차 길어지는 경향을 보인다. 집단 식중독의 주요 원인균인 비브리오패혈균에 감염될 경우 심한 경우 패혈증으로 진행돼 최대 50%에 달하는 치사율을 보일 수 있어 각별한 주의가 필요하다. 특히 간 질환자, 알코올 중독자, 면역 저하자 등 고위험군은 해산물 섭취나 바닷물 접촉 시 더욱 주의해야 한다. 감염 예방 수칙으로는 ▲ 해산물 등 어패류 충분히 익혀 먹기 ▲ 피부 상처 시 바닷물과 접촉 금지 ▲ 바닷물 접촉 후 물과 비누로 씻기 등이 있다. 연구원 관계자는 ""여름철 물놀이 인구 증가에 따라 감시 체계를 더욱 강화하고 있다""며 ""감염병 예방에 실질적으로 활용할 수 있도록 조사 결과를 각 지자체에 제공하고 있다""고 말했다. ryu@yna.co.kr",2025-06-10
https://www.yna.co.kr/view/AKR20250610063700076,인도 남부 해상서 싱가포르 화물선 화재…승무원 4명 실종,(방콕=연합뉴스) 강종훈 특파원 = 인도 남부 해상에서 싱가포르 화물선에 화재가 발생해 화물이 바다에 빠지고 승무원 4명이 실종됐다. 10일 로이터통신과 AFP통신에 따르면 전날 오후 12시30분께 인도 케랄라주 아지칼에서 남서쪽으로 약 80㎞ 떨어진 바다에서 싱가포르 선적 컨테이너선 완하이 503호에 폭발과 화재가 일어났다. 싱가포르 해양항만청(MPA)은 승무원 22명 중 4명이 실종됐다고 밝혔다. 구조된 18명 중 5명이 다쳐 치료 중이다. 이 사고로 컨테이너 40개가 아라비아해에 빠졌다. 사고 선박은 스리랑카 콜롬보에서 출발해 인도 뭄바이를 향해 운항 중이었다. 인도 해안경비대가 소셜미디어에 공개한 사진과 영상에는 폭발로 컨테이너가 흐트러지고 검은 연기가 피어오르는 모습이 담겼다. MPA는 선박 회사와 협력해 수습 중이며 사고 원인을 면밀히 조사하겠다고 밝혔다. 지난달 25일에도 케랄라주 앞바다에서 위험 화학물질 등을 실은 서아프리카 라이베리아 선적 컨테이너선이 침몰해 기름이 누출되는 사고가 발생했다. double@yna.co.kr,2025-06-10
https://www.yna.co.kr/view/AKR20250610048700055,'국산 나리 한자리에' 국립원예특작원서 11∼17일 나리 평가회,"(전주=연합뉴스) 김진방 기자 = 농촌진흥청은 국산 나리의 우수성을 알리고자 오는 11∼17일 국립원예특작과학원에서 '국내 육성 나리 평가회'를 연다고 10일 밝혔다. 이번 평가회에는 소비자를 비롯해 꽃 재배 농가, 구근(알뿌리) 작물 재배 농가, 유통업 관계자, 관련 연구자 등이 전문 평가단으로 참여한다. 국내 육성 나리 품종인 '스파클링라이트'는 나팔나리와 아시아틱나리 종간 교잡 품종으로 환경 적응성이 뛰어나 정원용으로 좋은 평가를 받고 있다. 또 '핑크힐' 품종은 소비자가 선호하는 분홍색 빛깔과 꽃 형태가 안정적이고 길이가 길어 절화용으로 주목받고 있다. 특히 이번 평가회에는 꽃꽂이용 품종뿐 아니라 조경·관상용으로 활용할 수 있는 팬지, 백묘국 품종도 선보인다. 이영란 원예특작원 화훼기초기반과장은 ""실수요자 중심의 품종 선발과 보급을 강화함으로써 국내 나리 산업의 경쟁력 강화와 소비 확대에 기여하겠다""고 전했다. chinakim@yna.co.kr",2025-06-10
https://www.yna.co.kr/view/AKR20250610028000504,"[게시판] 방사청, 방산업체 대상 기술보호 방문 교육","▲ 방위사업청은 방산업체의 기술보호 역량 강화를 위한 '2025년 방위산업 기술보호 교육'을 10일부터 실시한다고 밝혔다. 방문 교육은 지난해 40회에서 올해 50회로 확대됐고, 온라인 교육도 진행된다. 올해 교육과정에는 사이버보안 성숙도 모델 인증(CMMC) 제도에 관한 컨설팅도 포함됐다. (서울=연합뉴스)",2025-06-10
https://www.yna.co.kr/view/AKR20250610040200001,"권익위 ""장애인 탄 택시·업무차량도 전용주차 할 수 있어야""","""주차표지 발급기준, 車 아닌 사람 중심으로"" 복지부에 전환 권고 (서울=연합뉴스) 홍국기 기자 = 보행 장애인이 탑승한 택시나 업무용 차량 등도 장애인전용주차구역을 이용할 수 있어야 한다는 국민권익위원회 판단이 나왔다. 권익위 박종민 부위원장 겸 사무처장은 10일 e브리핑에서 장애인전용주차구역 주차 표지 발급 범위와 방식 등의 개선안을 마련해 보건복지부에 시행 권고했다고 밝혔다. 현재 장애인전용주차구역 주차표지는 보행 장애인 본인이나 함께 사는 민법상 가족의 보유·임차 자동차 한 대에만 발급되고 있다. 이에 따라 보행 장애인이 부득이하게 택시나 공유 차량, 업무용 차량 등을 일시적으로 사용할 경우에는 전용주차구역을 이용할 수 없다. 특히 경제적 이유 등으로 차량을 보유하지 않은 경우에는 보행상 장애가 있더라도 전용주차구역을 이용할 수 없다는 점에서 형평성 문제도 발생하고 있다. 박 부위원장은 ""미국, 호주 등 해외 일부 국가의 경우 보행 장애인이 탑승하고 있다면 소유주가 누구인지와 무관하게 장애인전용주차구역 이용이 가능하다""면서 ""우리나라도 자동차 중심이 아닌 사람 중심으로 주차표지 발급 기준을 전환하도록 개선안을 마련했다""고 설명했다. 또 ""주차표지 부당 사용을 방지하기 위해서는 고속도로 하이패스 요금 감면 제도처럼 위치 정보를 이용해 보행상 장애인의 탑승 여부를 확인하는 방식도 검토할 필요가 있다""는 의견을 제시했다. 아울러 현행 제도하에서는 보행 장애인이 공공기관이나 기업에 취업하더라도 업무용 자동차로는 장애인전용주차구역을 이용할 수 없다. 이에 권익위는 보행상 장애인이 업무용 자동차를 사용할 때도 장애인전용주차구역을 이용할 수 있도록 주차표지 발급 범위를 확대하라는 내용 또한 권고안에 담았다. 이 밖에 권고안에는 주차표지 반납 의무 규정 명확화와 고의로 미반납 시 과태료 제재 근거 마련, 장애인 관련 시설 운행 차량에 발급하는 주차표지에 유효기간을 설정하는 내",2025-06-10
https://www.yna.co.kr/view/AKR20250610041000030,"농식품부, '농촌빈집은행'사업 본격화…동의확인 소유자 참여","부동산 플랫폼에 '빈집 매물등록 지원'…소유자들에게 동의 의사 확인 안내 (서울=연합뉴스) 김윤구 기자 = 농림축산식품부는 농촌에 방치된 빈집을 새로운 자산으로 전환하기 위한 '농촌빈집 거래 활성화'(농촌빈집은행) 사업을 한다고 10일 밝혔다. 농촌빈집은행은 지방자치단체가 수집한 빈집 정보를 제공할 수 있도록 민간 부동산 플랫폼(한방, 디스코, 네이버부동산 등)과 귀농귀촌종합지원 플랫폼(그린대로)에 빈집을 매물로 등록하는 것을 지원하는 사업이다. 빈집이 부동산 플랫폼 등에 등록되고 실제 거래까지 이어지기 위해서는 빈집 소유자의 거래에 대한 동의가 필요하다. 이에 따라 18개 참여 시·군 중 빈집 소유자 정보를 확보한 충북 충주·옥천, 충남 예산·홍성, 전남 여수, 경북 예천, 경남 의령·거창·합천, 제주 등 10개 시·군에서 오는 11일부터 빈집 소유자에게 거래 동의 의사를 확인하는 문자를 발송한다. 그 외 8개 시·군도 올해 실태조사 등을 거쳐 빈집 소유자 정보를 확인한 뒤 순차적으로 문자를 발송할 계획이다. 문자를 받은 빈집 소유자는 동의서를 제출하면 빈집은행에 참여할 수 있다. 거래할 수 있는 빈집은 민간 부동산 플랫폼과 귀농귀촌종합지원 플랫폼 등에 올라간다. 농식품부는 앞서 지난 3월부터 참여 지자체를 모집했으며 현재 18개 지자체, 4개 관리기관, 약 100명의 공인중개사가 선정돼 농촌 빈집은행 운영을 준비 중이다. 농식품부와 각 지자체는 빈집 소유자의 참여 확대를 위해 이달 한 달간 전광판과 온라인을 통해 홍보 활동을 진행한다. 박성우 농식품부 농촌정책국장은 ""이번 안내는 방치된 농촌 빈집의 활용을 활성화하는 데 중요한 단계이므로 빈집 소유자들이 빈집은행에 많이 참가하기를 부탁드린다""고 말했다. ykim@yna.co.kr",2025-06-10
https://www.yna.co.kr/view/AKR20250610043700003,위츠·율촌화학 등 10개사 '월드클래스 후보기업' 선정,"정부, 4년간 총 342억원 연구개발 자금 등 '패키지 지원' (세종=연합뉴스) 차대운 기자 = 산업통상자원부는 10일 서울 더플라자 호텔에서 '2025 월드클래스 플러스 프로젝트 후보기업 선정식' 행사를 열고 위츠, 율촌화학 등 10개 기업을 새롭게 '월드클래스 후보 기업'으로 선정했다고 밝혔다. 산업부는 글로벌 전문 기업으로 성장하고자 하는 의지와 혁신 역량을 가진 중견기업을 월드클래스 기업으로 선정하고 기술 개발, 금융, 수출 등 분야의 지원을 하고 있다. 새 후보 기업으로 선정된 기업은 위츠, 제일연마공업, 서한이노빌리티, 덕일산업, 힘펠, 에이치에너지, 대원제약, 케이에스엠컴포넌트, 디에스테크노, 율촌화학 등 10개사다. 미래 모빌리티, 이차전지, 에너지 신산업, 핵심 소재, 첨단 제조 등 분야에 걸쳐 있다. 산업부는 이들 기업에 향후 4년간 기업당 평균 34억원씩, 총 342억원 규모의 연구개발(R&D) 자금을 제공한다. 또한 금융, 수출, 컨설팅, 법률 자문 등 기업 활동 전반을 아우르는 패키지형 지원도 함께 이뤄진다. cha@yna.co.kr",2025-06-10
https://www.yna.co.kr/view/AKR20250610039100003,"6월 서울 아파트 분양전망지수 18.5p↓…""토허제 상승효과 약화""","주산연 조사…'미분양 해소' 기대감에 지방 전망은 소폭 상승 (서울=연합뉴스) 오예진 기자 = 이번 달 서울 아파트 분양전망지수가 전월 대비 큰 폭으로 하락했으나 3개월 연속 기준선(100.0)을 넘었다. 10일 주택산업연구원(주산연)에 따르면 지난달 15∼25일 주택 사업자를 대상으로 설문 조사한 결과 6월 서울 아파트 분양 전망 지수는 전월 대비 18.5포인트 하락한 103.7로 나타났다. 지수가 100을 넘으면 긍정적인 전망 우세를, 100 미만이면 부정적 전망 우세를 나타낸다. 서울 지수는 토지거래허가구역 해제 영향과 금리 인하 및 대선에 대한 기대감 등으로 지난 4월에 5개월 만에 기준선을 넘은 뒤 지난달까지 2개월 연속 대폭 올랐다. 이번 달에는 토지거래허가구역 해제와 확대·재지정 과정에서 나타났던 급격한 상승효과가 약화한 가운데 다음 달 스트레스 총부채원리금상환비율(DSR) 3단계 시행등의 영향으로 하락한 것으로 분석됐다. 시장에서는 DSR 3단계 시행을 앞두고 서울과 수도권 내 단지들이 공급 일정을 앞당기며 한시적으로 분양 물량이 증가해 분양 경쟁이 치열해질 것으로 내다봤다. 서울 지수가 하락하긴 했지만 지난 4월 이후 3개월 연속 100을 웃돌고 있어 여전히 긍정 전망이 우세한 상황이다. 수도권 중 인천(110.0)은 13.6포인트 상승했고, 경기(100.0)는 2.8포인트 하락해 수도권 전체로는 2.5포인트 하락한 104.6을 나타냈다. 비수도권(92.5)은 2.2포인트 상승했는데, 새 정부에서 지방 미분양 물량을 해소할 대책을 마련할 것이라는 기대감이 작용한 것으로 해석됐다. 전국 지수는 94.6으로 전월 대비 1.3포인트 올랐다. 미분양 물량 전망 지수는 전월보다 5.5포인트 하락한 103.3을 나타냈다. 분양 가격 전망 지수는 8.9포인트 상승한 111.9로, 분양 물량 전망 지수는 1.0포인트 오른 96.6으로 조사됐다. ohy",2025-06-10
https://www.yna.co.kr/view/AKR20250610047800003,"개발사업 인허가 속도 높인다…국토부, 민관 TF 발족","'신속 인허가 지원센터' 설치·운영 관련 각계 의견 청취 (세종=연합뉴스) 임기창 기자 = 이재명 대통령이 후보 시절 주택 공급 신속인허가 제도를 도입해 인허가 기간을 단축하는 공약을 제시한 가운데 정부도 이와 관련한 제도적 지원책을 추진하고 있다. 국토교통부는 '신속 인허가 지원센터' 설치를 위한 민관 태스크포스(TF)를 발족하고 10일 서울에서 1차 TF 회의를 개최한다고 밝혔다. 앞서 국토부는 올해 초 발표한 주요 업무 추진계획에서 지원센터 설치 계획을 밝힌 바 있다. 이날 회의에는 민간 전문가들과 업계·협회 관계자들이 참석해 부동산 개발사업 인허가 관행의 문제점과 현장의 사업 지연 사례를 공유하고, 지원센터의 효율적 운영 방안에 관한 의견을 나눌 예정이다. 최근 건축자재비와 인건비 상승 등으로 개발사업 여건이 어려운 가운데 지방자치단체의 인허가 불확실성에 따른 사업 지연이 금융비용 증가와 분양가 상승으로 이어진다는 지적이 많았다. 이에 국토부는 올 3월부터 연구용역 등을 통해 실제 인허가 지연 사례를 취합해 인허가가 늦어지는 원인을 분석하고 신속 인허가 지원센터 운영 방안을 준비해 왔다. 현장 의견 수렴 과정에서도 관할 지자체가 자의적으로 법령을 해석하거나 광역·기초지자체 간 심의 의견이 다른 경우, 유사 사례가 없다는 이유로 인허가를 지연하거나 불허하는 경우 등이 문제로 거론됐다고 국토부는 전했다. 실제로 한 지자체는 건축 심의 전 통과된 교통영향평가 결과와 다른 교통처리계획을 심의 종결 후 요구해 사업 진행이 늦어지는 결과를 초래했고, 또 다른 지자체는 건축법상 1개 필지 내에 여러 개의 개별 건물 건축이 가능함에도 해당 지역에서 사례가 없다는 이유를 들어 허가를 지연시키기도 했다. 한편으로는 지자체의 인허가 담당 공무원들이 중앙부처의 구체적 해석이나 지침이 없는 상황에서 재량을 발휘했다가 특혜 시비나 감사에 연루될 수 있어 인허가가 늦어진다는 시각도 있다. 향후 신속 인허가 지원센",2025-06-10
https://www.yna.co.kr/view/AKR20250610053200504,"방사청, '절충교역 매칭'으로 방산 중소기업 수출 지원","(서울=연합뉴스) 김철선 기자 = 방위사업청은 국내 방산 중소기업의 해외시장 진출을 지원하기 위한 '2025 절충교역 산업협력' 행사를 10일부터 이틀간 대전 인터시티 호텔에서 개최한다고 밝혔다. 방사청과 국방기술진흥연구소가 공동으로 주관하는 행사로, 국내 방산 중소기업이 절충교역 제도를 활용해 글로벌 방산기업과 1대1 수출 협의를 진행할 수 있는 자리가 마련된다. 절충교역은 해외로부터 무기나 장비를 구입할 때 그 반대급부로 국내 중소기업 등이 만든 부품을 수출하거나 관련 기술을 이전받는 방식의 교역 형태다. 절충교역 산업협력 행사는 방사청이 2014년부터 매년 2회 개최하고 있으며, 이번 행사에는 록히드 마틴과 보잉, 에어버스 등 10개 글로벌 기업과 국내 방산 중소기업 30여곳이 참여한다. kcs@yna.co.kr",2025-06-10
