url,title,summary,date
https://www.yna.co.kr/view/AKR20250610046600051,부산에 동남권산업투자공사 설립 잰걸음…여당 주도 법안 발의,"부산시 ""과거 실패한 모델"" 냉담 (부산=연합뉴스) 민영규 기자 = 윤석열 정부에서 논란 끝에 결실을 보지 못한 한국산업은행 본점 부산 이전의 대안으로 이재명 대통령이 대선후보 시절 공약한 부산 동남투자은행(가칭) 설립이 속도를 낼지 주목된다. 이 대통령은 대선 당시 부산 유세에서 ""갈등만 키우고 진전 없이 반복된 산업은행 이전 논란을 넘어 해양산업금융을 실질적으로 지원하고 청년 일자리 확대까지 실현하는 대안이 될 것""이라며 ""해양수도 부산에 동남투자은행 설립을 추진하겠다""고 말했다. 이에 따라 더불어민주당 민병덕 의원을 비롯한 여당 의원 46명은 대선 본투표 하루 전인 지난 2일 '동남권산업투자공사 설립 및 운영에 관한 법률안'을 제출해 이 대통령의 공약을 뒷받침했다. 이 법안은 부산에 본사를 둔 동남권산업투자공사를 설립해 동남권 기업과 벤처기업, 스타트업 지원을 위한 투자와 자금 융자를 제공하도록 했다. 법안은 초기 자본금 3조원을 정부, 부산시, 울산시, 경상남도, 한국산업은행, 중소기업은행, 한국수출입은행이 출자하도록 하고 정부가 운영 경비 등을 지원할 수 있다는 내용을 담았다. 이에 대해 민병덕 의원실은 10일 ""부울경 지역 기업에 자금을 지원하는 데 그치지 않고, 일자리 창출과 경제 활성화를 위한 정책 추진 등을 위해 투자공사 설립을 추진하기로 했다""면서 ""관련 법안이 신속히 통과될 수 있도록 최선을 다할 것""이라고 밝혔다. 부산 동남권산업투자공사 설립은 내년 지방선거를 앞두고 속도를 높일 가능성이 크다는 것이 지역 정가와 경제계의 대체적인 관측이다. 특히 지역 현안인 산업은행 본점 부산 이전이 민주당의 부정적인 기류 등으로 차질을 빚으면서 현 여권에 대한 부산시민의 시선이 곱지 않은 가운데 나온 카드여서 여권이 신속한 동남권산업투자공사 설립 추진으로 분위기 전환을 시도할 것이라는 분석이 나온다. 그러나 부산시는 다소 냉담한 반응을 보인다. 동남권산업투자공사",2025-06-10
https://www.yna.co.kr/view/AKR20250610023600003,"LG전자, 美 예비부부 10쌍 결혼 서약식 지원…워시타워 선물","(서울=연합뉴스) 한지은 기자 = LG전자[066570]는 최근 미국 뉴욕 하이라인 파크에서 결혼 서약식 '러브 투 런드리'(Love to laundry) 행사를 했다고 10일 밝혔다. LG전자는 특별한 사연을 가진 연인 10쌍을 사전 공모를 통해 선정해 결혼 서약식을 갖도록 지원하고, 이들에게 각각 워시타워 1대를 선물했다. 이번 행사는 LG전자가 지난해부터 추진한 '러브 투 런드리' 캠페인의 일환이다. 편리한 기능을 갖춘 LG 세탁 가전을 쓰며 가족이나 연인과 함께하는 시간을 더 많이 갖자는 메시지를 전한다. writer@yna.co.kr",2025-06-10
https://www.yna.co.kr/view/AKR20250610024900002,"[게시판] 공정거래조정원, 정기 간행물 '공정한 동행' 발간","▲ 한국공정거래조정원은 '공정한 동행' 2025년 봄·여름호를 발간했다고 10일 밝혔다. 공정한 동행은 최신 공정거래 동향에 대한 분석과 논평, 중소사업자의 피해예방을 위한 분쟁조정 사례 소개 등을 담은 정기 간행물로 연 2회 발간된다. 이번 호에서는 미국의 경업금지 동향, 경쟁 제한적 규제개선 사례 등이 담겼다. (세종=연합뉴스)",2025-06-10
https://www.yna.co.kr/view/AKR20250610028800061,수면마취 후 운전하다 도로서 잠든 운전자…경찰 적발 사례 공개,"3월말 정차 명령에도 1㎞ 더 운전하다 신호대기 차량 들이받아 (성남=연합뉴스) 권준우 기자 = ""빵빵!"" 지난 3월 31일 오전 10시께 경기 성남시 분당구 정자동의 편도 6차선 도로 5차로에는 앞 범퍼가 파손된 재규어 승용차가 도로 위에 멈춰 서 있었다. 경적을 울려도 움직이지 않는 승용차를 피해 가기 위해 뒤따르던 운전자들은 황급히 다른 차선으로 방향을 틀어야 했고, 차들이 뒤섞이며 도로에는 한동안 정체가 빚어졌다. 정차 중인 차 안에서는 60대 남성 A씨가 가만히 고개를 떨구고 있었다. 이를 본 한 운전자는 ""사고 차량에 운전자가 가만히 고개를 숙이고 있어 위험해 보인다""며 112 신고를 했다. 또 다른 운전자는 차를 세운 뒤 A씨 차량으로 다가가서 운전석 문을 열고 말을 걸었다. 그러자 A씨는 졸음에서 깬 듯 황급히 정신을 차리더니 갑자기 다시 차를 몰기 시작했다. 현장에 출동한 경찰은 주행 중인 A씨 차량을 발견해 정차 명령을 했다. 그러나 A씨는 아랑곳하지 않고 1㎞가량을 더 운전하다가 신호 대기 중인 앞차를 들이받는 사고를 내고서야 멈춰 섰다. 경찰은 곧바로 음주 측정을 했으나 감지기에는 별다른 반응이 없었다. 뒤이어 실시한 마약 정밀검사에서는 향정신성 의약품에 해당하는 미다졸람(최면진정제)이 검출됐다. 조사 결과 A씨는 같은 날 오전 9시께 인근 병원에서 수면내시경을 받은 것으로 확인됐다. 이후 A씨는 약 기운이 남은 상태에서 병원 지하주차장에서 출차하다가 연석을 들이받는 1차 사고를 냈음에도 3㎞가량 떨어진 사고 지점까지 계속해 운전한 것으로 파악됐다. 이에 경찰은 도로교통법 위반, 위험운전치상 혐의로 A씨를 불구속 입건해 검찰에 송치했다. 약물로 인해 정상적으로 운전하지 못할 우려가 있는 상태에서 운전할 경우 도로교통법 제148조2의 제4항에 의해 3년 이하의 징역 또는 1천만원 이",2025-06-10
https://www.yna.co.kr/view/AKR20250610047000004,"광화문스퀘어 프로젝트 첫 회의…""빛의 광화문 시대 본격화""","KT·교보생명 등 전광판 순차 설치…미디어폴 설계 착수 (서울=연합뉴스) 윤보람 기자 = 서울 종로구(구청장 정문헌)는 전날 구청 기획상황실에서 '광화문스퀘어 옥외광고물 자유표시구역 민관합동협의회' 상반기 정기회의를 개최했다고 10일 밝혔다. 이번 회의는 지난해 12월 협의회 출범과 올해 4월 사무국 개소 이후 열린 첫 정기회의다. 상반기 추진 성과를 점검하고 하반기 실행 전략 및 GMP(광화문스퀘어 미디어 플랫폼) 구축 방안 등을 검토했다. 광화문스퀘어 프로젝트는 광화문광장과 세종대로 일대를 뉴욕 타임스 스퀘어처럼 디지털 옥외광고와 문화예술이 결합된 '세계적인 미디어 랜드마크'로 조성 중인 사업이다. 종로구와 서울시, 행정안전부 등 공공기관은 물론 사업구역 내 건물주와 광고·법률·회계 전문가 등으로 구성된 민간협의회가 사업을 주도하고 있다. 현재 코리아나호텔이 전광판 시범 운영을 시작했으며 오는 8월에는 KT WEST, 10월에는 동아일보 건물에 전광판이 설치된다. 연말까지 교보생명, 동화면세점, 다정빌딩 등 총 9개 건물의 전광판이 순차적으로 설치될 예정이다. KT 전광판 개시에 맞춰 광화문스퀘어 오프닝 행사도 열린다. 자유표시구역 내 '미디어폴(Media Pole)' 사업도 본격화됐다. 지난달 사업시행사가 선정됐고, 현재 설계가 진행 중이다. 콘텐츠도 한층 다양해진다. 서울시 및 국내 최초 국제 아트페어인 키아프(KIAF)와 협약을 체결하고 수준 높은 미디어아트 전시를 준비 중이다. 연말에는 광화문광장과 연계한 대형 카운트다운 퍼포먼스도 추진한다. 김진수 건국대 도시·지역계획학과 교수는 ""광화문은 서울의 핵심 거점""이라며 ""이 프로젝트가 본궤도에 오르면 뉴욕 타임스 스퀘어처럼 도시 브랜드를 끌어올리고 경제적 파급 효과도 상당할 것""이라고 전망했다. 실제 뉴욕의 원 타임스 스퀘어(One Times Square)는 1996년 대형 광고판 설치 후 건물 가치가 약 5억달러(약 6",2025-06-10
https://www.yna.co.kr/view/AKR20250610046800071,"트럼프 1기때 대북협상 맡았던 후커, 美국무차관으로 활동 개시","정무차관으로서 한미ㆍ북미관계 다루는 동아태국 업무도 관할 (워싱턴=연합뉴스) 조준형 송상호 특파원 = 도널드 트럼프 미국 대통령 첫 임기 때 백악관에서 대북 협상 업무를 담당했던 앨리슨 후커 전 국가안보회의(NSC) 아시아 담당 선임보좌관이 최근 의회 인준 절차를 통과한 뒤 국무부 정무차관으로 정식 취임한 것으로 9일(현지시간) 확인됐다. 미 연방 의회 홈페이지에 따르면 후커 차관은 지난 3일 연방 상원의 인준 표결이 찬성 59표, 반대 36표로 가결 처리됨에 따라 차관으로 취임했다. 언론에 공개되는 국무부 일정에 따르면 후커 차관은 10일 마코 루비오 국무장관이 아랍에미리트(UAE) 외무장관과 회담할 때 배석할 예정이다. 지난 2월 트럼프 대통령에 의해 지명된 후커는 정무차관으로서 국무부의 지역과 양자 정책 현안 전반을 관장한다. 한국 업무를 담당하는 동아시아태평양국을 비롯한 지역별 정책국이 정무차관 관할이어서 그는 한미관계와 북미관계에도 관여한다. 후커 차관은 2001년부터 2014년까지 국무부 정보·조사국에서 선임 분석가로 일한 뒤 트럼프 1기 행정부(2017∼2021년) 때 백악관 NSC에서 한반도 업무를 담당했다. 2018∼2019년 싱가포르, 베트남 하노이, 판문점에서 각각 열린 트럼프 대통령과 김정은 북한 국무위원장의 회담에 깊숙이 관여했다. 따라서 후커 차관은 앞으로 북미대화가 다시 추진될 경우 재차 중요한 역할을 맡게 될 가능성이 없지 않아 보인다. jhcho@yna.co.kr",2025-06-10
https://www.yna.co.kr/view/AKR20250610047500003,국내 CEO들이 뽑은 명품 브랜드…대한항공·제네시스·갤럭시 등,"(서울=연합뉴스) 홍규빈 기자 = 국내 500대 기업 최고경영자(CEO)들이 선호하는 '명품 브랜드'는 대한항공, 제네시스, 갤럭시 스마트폰 등으로 나타났다. 10일 월간 현대경영이 발표한 '500대 기업 CEO 선정 올해의 CEO 명품'에 따르면 대한항공은 91.49%로 가장 높은 선호도를 기록했고 제네시스(85.26%), 갤럭시 스마트폰(72.63%)이 뒤를 이었다. 이밖에 SK텔레콤(69.32%), 참이슬 소주(64.18%), 제주삼다수(61.96%), 카스 맥주(50.00%), 신세계백화점(39.36%), 금강구두(39.13%), 발렌타인 양주(38.46%), 갤럭시 신사복(35.06%), 래미안 아파트(34.33%) 등이 높은 평가를 받았다. 은행, 보험 등으로 영역을 나눈 금융권 조사에서는 삼성생명(33.33%), 미래에셋증권(28.95%), KB국민은행(28.89%), 삼성화재(22.73%), 현대카드(17.31%)가 각 부문에서 최다 선택을 받았다. 인재 양성 부문에선 서울대 MBA(55.07%), 경희사이버대(32.61%), 인하공전(33.33%)이 꼽혔고 미디어 부문에선 KBS 9시 뉴스(38.10%), 조선일보(42.03%), 매일경제(75.58%)의 선호도가 높았다. 올해 처음 조사한 펫푸드와 혁신 신약 분야에서는 하림펫푸드(46.88%)와 셀트리온(40.54%)이 뽑혔다. 한편 응답자들은 미래의 K-명품 산업군으로 방산(34.04%), 바이오(27.66%), 컬쳐(23.40%), 푸드(12.77%) 등을 꼽았다. 이번 조사는 지난 3월 5일부터 4월 25일까지 매출액 500대 기업 최고경영자를 대상으로 이뤄졌고 총 100명이 응답했다. bingo@yna.co.kr",2025-06-10
https://www.yna.co.kr/view/AKR20250610044100073,"日쌀값, 반년만에 2주째 하락…정부는 '반값 비축미' 추가 방출","작년 대비 여전히 2배 수준 높아…농림상 ""쌀 조기 수입 등 뭐든 할 것"" (도쿄=연합뉴스) 박상현 특파원 = 천정부지로 치솟던 일본 쌀값이 작년 11월 이후 약 반년 만에 2주 연속 하락했다고 아사히신문 등이 10일 보도했다. 일본 농림수산성은 지난달 26일부터 이달 1일까지 전국 슈퍼 1천 곳에서 판매된 쌀 5㎏ 평균 가격이 전주 대비 0.9% 떨어진 4천223엔(약 4만원)으로 집계됐다고 전날 발표했다. 쌀값은 2주째 하락했으나, 작년 같은 기간 가격인 2천136엔(약 2만원)과 비교하면 여전히 두 배 수준이었다. 아사히는 ""쌀값이 본격적으로 내려간다고 실감하기는 힘든 상황""이라면서도 시세보다 저렴한 정부 비축미 유통량이 늘어난 것이 쌀값 하락세에 영향을 미친 것으로 보인다고 해설했다. 고이즈미 신지로 농림수산상이 기존 입찰 방식 대신 소매업자와 직접 거래하는 수의계약을 통해 방출한 이른바 '반값 비축미'가 점포에서 팔리기 시작한 시점은 지난달 31일이어서 이번 조사 결과에는 거의 반영되지 않았다. 따라서 농림수산성이 매주 발표하는 쌀 가격이 다음 주에는 더 떨어질 가능성이 크다는 분석도 나온다. 이와 관련해 니혼게이자이신문(닛케이)은 니가타현산 고시히카리 현미 60㎏의 업자 간 거래 가격이 전날 4만5천250엔(약 42만4천원) 정도로 전주 대비 8% 떨어졌다고 전했다. 다른 지역의 일부 유명 쌀 품종 거래가도 10% 이상 하락했다. 다만 반값 비축미는 도쿄도를 중심으로 하는 수도권과 오사카부, 효고현 등이 있는 간사이 지역 등 대도시 지역에 공급이 집중되는 경향이 나타나고 있다고 닛케이가 분석했다. 이 신문은 ""도호쿠 지방, 시코쿠 등에 있는 30개 광역지자체는 '공백 지대'가 되고 있다""며 소매업체들이 이달 중순 이후 반값 비축미의 전국 판매를 추진할 계획이어서 쌀값의 지역 간 격차가 줄어들 것인지가 초점이라고 짚었다. 한편, 지난달 21일 취임 이후 쌀값을 잡기 위해 모든",2025-06-10
https://www.yna.co.kr/view/AKR20250610046100063,"대전시, 여름철 하천 수질오염 특별감시·단속 나서","(대전=연합뉴스) 김준범 기자 = 대전시는 하천 수질오염 사고 예방을 위해 '하절기 환경오염행위 특별감시 및 단속'에 나선다고 10일 밝혔다. 단속 대상은 악성 폐수 배출업체, 폐수 다량 배출업체, 폐수수탁처리업체 등이다. 시는 이달 사전 홍보와 계도 활동을 한 뒤 오는 7월부터 두 달간 집중 감시 및 단속을 펼친다. 고의적이고 상습적인 불법행위 사업장을 확인하면 특별관리와 함께 강력한 행정 조치를 병행한다. 다만 도움이 필요한 영세사업장의 경우 환경 기술지원을 통해 배출 및 방지시설 운영을 유도한다. 문창용 대전시 환경국장은 ""여름철 집중호우 기간 오염물질이 하천으로 유입되는 것을 막기 위해 철저한 단속에 나설 것""이라고 말했다. psykims@yna.co.kr",2025-06-10
https://www.yna.co.kr/view/AKR20250610048000061,"용인시 노사민정, 임금체불·불법행위 근절 공동 선언","(용인=연합뉴스) 김광호 기자 = 경기 용인시는 지난 9일 시청에서 임금체불 및 불법행위 근절을 위한 노사민정 공동선언 협약을 체결했다고 10일 밝혔다. 협약식에는 시 노사민정협의회 위원장인 이상일 시장을 비롯해 유진선 시의회 의장, 오기환 고용노동부 경기지청장, 이상원 한국노총 용인지역지부 의장, 이태열 용인상공회의소 회장 등 노사민정 각 대표와 사측 대표 6명이 참석했다. 공동 선언문에는 근로자가 불법행위에 단호히 대응하고, 생산성·서비스 질 향상과 상생의 노사문화 정착을 위해 적극 협력한다는 내용이 담겼다. 또 사용자는 법적 의무를 준수하고, 근로자의 권익을 존중하며, 공정한 기업문화 조성을 위해 노력하기로 했다. 시민은 불법행위 근절 등이 지역사회에 뿌리내릴 수 있도록 인식 확산에 함께하고, 시와 고용노동부 경기지청은 공정한 근로환경 등을 조성하는 데 협력할 예정이다. 이 시장은 ""공동 선언문에 담긴 임금체불과 불법행위 근절을 실천한다면 도시와 기업, 일터, 가정 모두 발전할 수 있을 것""이라며 ""노동의 가치가 존중받을 수 있도록 용인시는 소통과 협력을 바탕으로 원만하게 문제를 해결하고, 임금체불이나 불법행위가 없도록 노력하겠다""고 말했다. kwang@yna.co.kr",2025-06-10
https://www.yna.co.kr/view/AKR20250610047400056,제주 해안가서 신원미상 남성 변사체 발견,(제주=연합뉴스) 변지철 기자 = 10일 오전 9시 3분께 제주시 구좌읍 한동리 해안가 방파제 앞 바다에서 신원을 알 수 없는 남성 변사체가 떠 있는 것을 낚시객이 발견해 119에 신고했다. 119 구급대와 해경에 의해 수습된 시신은 60대 남성으로 추정된다. 해경은 숨진 사람의 신원과 사망 원인을 조사하고 있다. bjc@yna.co.kr,2025-06-10
https://www.yna.co.kr/view/AKR20250610046700054,신안서 11∼14일 피아노 제조·조율사 국제총회 열린다,"(신안=연합뉴스) 조근영 기자 = 전남 신안군은 국제 피아노 제조기사 및 조율사 협회(International Association of Piano Builders and Technicians·이하 IAPBT) 국제총회가 오는 11∼14일 자은도에서 열린다고 10일 밝혔다. 한국피아노조율사협회가 주관하는 총회는 피아노 기술의 발전과 음악 문화의 지속 가능성을 논의하는 글로벌 행사다. 세계 각국 전문가들이 참여해 산업적 혁신과 예술적 가치의 융합을 다룬 연구 결과를 발표하고 교류한다. IAPBT는 피아노 제작과 조율 기술의 혁신을 주도하는 국제적 협회로 피아노 산업과 교육 분야의 발전을 위해 다양한 연구 및 교육 프로그램을 운영해 왔다. 이번 총회 주제는 '인간과 피아노(HUMAN AND PIANO)'로 피아노가 인간의 삶에 미치는 영향과 미래 발전 방향을 논의한다. 주요 피아노 제작 업체 특강, 독일 정음 전문가의 파이널 보이싱, 음악지도자를 위한 특별세미나 등이 진행된다. 최신 피아노 기술과 혁신적인 설계로 제작된 피아노와 관련 기술 전시회도 열린다. 신안군 관계자는 ""피아노 섬 기반 조성과 정체성 확장을 위해 IAPBT 총회를 유치하게 됐다""며 ""세계 각지의 피아노 전문가가 방문하는 만큼 적극적으로 피아노 섬을 홍보하겠다""고 말했다. chogy@yna.co.kr",2025-06-10
https://www.yna.co.kr/view/AKR20250610046400061,"김동연, 강민석 대변인 재기용…캠프 참여 참모진 대부분 복귀","(수원=연합뉴스) 최찬흥 기자 = 김동연 경기도지사는 10일 신임 대변인에 강민석 전 대변인을 다시 임용하는 등 개방형 임기제 인사를 단행했다. 언론협력담당관에는 이은호 전 담당관을, 노동권익과장에는 조상기 전 과장을 재기용했다. 앞서 김 지사는 지난 4일 경제부지사에 고영인 전 경제부지사를, 정무수석과 기회수석에 윤준호 전 수석과 강권찬 전 수석을 각각 임명했다. 안정곤 전 비서실장의 경우 정책수석으로 자리를 바꿔 임용했다. 이들은 모두 지난 4월 치러진 더불어민주당 대선 경선에 참여한 김 지사를 돕기 위해 사직한 핵심 참모진이다. 경기도는 이들이 각 분야의 전문성을 갖춰 민선 8기 후반기 주요 도정 추진에 동력을 확보하게 됐다고 설명했다. 그러나 도의회 국민의힘은 지난 4일 성명을 내 ""김 지사의 주특기인 '회전문 인사'가 다시 시작됐다""며 ""경기도를 놀이터 삼아 제집 드나들 듯 무례함을 일삼는 정무 라인을 절대 인정할 수 없다""며 전원 사퇴를 요구했다. chan@yna.co.kr",2025-06-10
https://www.yna.co.kr/view/AKR20250610045100007,한일 프로골프 투어 공동주관 하나은행 인비테이셔널 12일 개막,"김백준·지난해 우승자 오기소 등 한일 정상급 선수들 '샷 대결' (서울=연합뉴스) 김동찬 기자 = 한국과 일본 프로골프 투어가 공동 주관하는 하나은행 인비테이셔널(총상금 13억원)이 12일부터 나흘간 경기도 안산시 더헤븐 컨트리클럽(파72·7천293야드)에서 열린다. 이 대회는 한국프로골프(KPGA) 투어와 일본프로골프 투어(JGTO) 공동 주관으로 2023년 일본에서 개최됐고, 지난해와 올해는 한국에서 우승자를 가려낸다. KPGA 투어와 JGTO 시드 우선순위 등 총 144명이 출전하며 이 가운데 한국 국적 선수는 75명, 일본 국적 선수는 55명이다. 일본에서 열린 2023년 대회에서 양지호가 우승했고, 한국에서 개최된 지난해에는 오기소 다카시(일본)가 정상에 올랐다. 지난주 백송홀딩스 아시아드CC 부산오픈에서 우승한 김홍택이 2주 연속 우승에 도전한다. 올해 스크린 골프 대회와 KPGA 투어에서 모두 우승을 달성하는 등 상승세가 돋보이는 김홍택은 ""여기에 만족하지 않고, 좋은 흐름을 이어가 하나은행 인비테이셔널에서도 우승까지 도전해보겠다""고 다짐했다. 지난해에는 오기소가 장유빈을 1타 차로 따돌리고 프로 데뷔 첫 우승의 기쁨을 누렸다. 오기소는 ""첫 우승을 한국에서 했기 때문에 한국에서 경기하는 것을 기대하고 있다""며 ""컨디션은 좋고, 이번 대회에서도 우승 경쟁을 하도록 최선을 다하겠다""고 각오를 전했다. 또 김홍택 외에 현재 제네시스 포인트 1위 김백준과 이태훈, 문도엽, 배용준, 엄재웅 등이 시즌 첫 2승을 노린다. JGTO 시즌 상금 선두인 쇼겐지 다쓰노리(일본)도 이번 대회에 나온다. 올해 한국오픈에서 우승한 KPGA 투어 상금 1위 사돔 깨우깬자나(태국)는 이번 대회에 불참한다. 상금 순위 2∼6위인 이태훈, 문도엽, 김백준, 엄재웅, 옥태훈은 이번 대회 우승 상금 2억6천만원을 받으면 상금 1위가 될 수 있다. 대회 타",2025-06-10
https://www.yna.co.kr/view/AKR20250609131800004,"서울시, 민간과 손잡고 가족돌봄청년 일상·마음까지 돌본다","6개 기업·단체와 업무협약…자산형성·금융 교육도 (서울=연합뉴스) 윤보람 기자 = 서울시는 기업·단체와 손잡고 '가족돌봄청년'의 자산 형성, 심리상담, 일상돌봄까지 지원을 확대한다고 10일 밝혔다. 시는 이날 오전 서울시청에서 미래에셋박현주재단, 아름다운재단, 롯데백화점, 희망친구 기아대책, 한화생명, 월드비전과 가족돌봄청년 지원을 위한 업무협약을 체결했다. 이번 협약으로 미래에셋박현주재단과 아름다운재단은 총 2억원을 투입해 가족돌봄청년 25명에게 1인당 400만원의 상장지수펀드(ETF)를 지급한다. 또 경제·재무 교육과 운영보고서 등을 제공해 건전한 자산 형성을 돕고 금융 역량을 강화할 방침이다. 롯데백화점과 기아대책은 4억원을 들여 가족돌봄청년 및 가족 200명을 대상으로 롯데 리조이스 심리상담소 4곳(잠실·동탄·수지·타임빌라스 수원점)에서 상담을 제공하고 장학금과 자조 모임 등을 지원한다. 한화생명과 월드비전은 가족돌봄청년의 간병 부담을 덜어주기 위한 비대면 청소·세탁 등 일상돌봄 서비스와 네트워크 형성을 돕는다. 특히 현재 가족돌봄청년 2천515명을 지원 중인 월드비전과 정보를 공유해 앞으로는 서울시 또는 월드비전 중 한 곳에만 가족돌봄청년 신청하면 양쪽에서 모든 지원을 받을 수 있게 할 계획이다. 시는 각 기관과 지원사업별 세부 내용, 신청 기준 등을 확정한 뒤 이달 중순부터 서울시복지재단 가족돌봄지원팀을 통해 차례로 지원 신청을 받을 예정이다. 가족돌봄청년은 전화(☎ 02-6353-0336), 복지포털 누리집, 카카오톡 채널(서울시가족돌봄청년지원 WAY) 등에서 관련 정보를 얻고 서비스를 신청할 수 있다. 서울시는 2023년 8월부터 여러 공공·민간기관과 업무협약을 맺고 가족돌봄청년의 주거·의료·생계를 지원해왔다. 올해 4월 말 기준으로 가족돌봄청년 522명에게 총 2천191건을 지원했다. 이날 협약식에선 아픈 아버지를 돌보며 프리랜서 방송인 활동을 활발히 이어가고 있",2025-06-09
